System,State,Sentiment_1_RAW,Headline,Sentiment_1,Sentiment_2,Metadata
Aquaculture,South Australia,2,"Global Aquaculture Insurance Market Outlook 2021 Analysis by Leading Keyplayers | AXA,PICC,QBE,JLT – Industrial ITIndustrial IT4 days agobookmark_bordersharemore_vert",Neutral,,"NAGlobal Aquaculture Insurance Market Outlook 2021 Analysis by Leading Keyplayers | AXA,PICC,QBE,JLT – Industrial ITIndustrial IT4 days agobookmark_bordersharemore_vert"
Aquaculture,South Australia,2,Global Aquaculture Market to Reach $232.4 Billion by 2026,Neutral,,PRNewswire27 May 2021bookmark_bordersharemore_vert
Aquaculture,South Australia,2,Global Aquaculture Market to Reach $245.2 Billion by 2027,Neutral,,GlobeNewswire12 Julybookmark_bordersharemore_vert
Aquaculture,South Australia,0,Global Sea Bass Market Opportunity Analysis and Industry Forecast 2021-2030: Rising Demand for Organic Seafood Boosting Market Proliferation - Research,NA,,AndMarkets.comYahoo Finance27 Octbookmark_bordersharemore_vert
Aquaculture,South Australia,0,Global Sea Bass Market Report 2021: Sustainable Sea Bass,NA,,GlobeNewswire29 Octbookmark_bordersharemore_vert
Aquaculture,South Australia,0,Global Sea Bass Market to Garner $7.9 billion by 2030: Allied Market Research,NA,,GlobeNewswire28 Julybookmark_bordersharemore_vert
Aquaculture,Australian Capital Territory,0,"Global seafood supply could shrink if we don’t act now, study says. Here’s why",NA,,Miami Herald14 Decbookmark_bordersharemore_vert
Aquaculture,Tasmania,0,Go,NA,,FundMe launched for family run over at camping groundThe Mercury10 days agobookmark_bordersharemore_vert
Aquaculture,Queensland,3,"Golden harvest as value of farms, crops rise",Positive,,The Australian3 days agobookmark_bordersharemore_vert
Aquaculture,Victoria,0,"Golden harvest as value of farms, crops rise",NA,,The Australian3 days agobookmark_bordersharemore_vert
Aquaculture,New South Wales,0,"Golden harvest as value of farms, crops rise",NA,,The Australian3 days agobookmark_bordersharemore_vert
Aquaculture,Northern Territory,0,"Golden harvest as value of farms, crops rise",NA,,The Australian3 days agobookmark_bordersharemore_vert
Aquaculture,Western Australia,0,"Golden harvest as value of farms, crops rise",NA,,The Australian3 days agobookmark_bordersharemore_vert
Aquaculture,Victoria,2,Goulburn's Marianvale Blue Murray Cod farm destocks due to downturn,Neutral,,Goulburn Postbookmark_bordersharemore_vert
Aquaculture,New South Wales,2,Goulburn's Marianvale Blue Murray Cod farm destocks due to downturn,Neutral,,Goulburn Postbookmark_bordersharemore_vert
Aquaculture,Australian Capital Territory,0,gov.ie - Aquaculture & Foreshore Management,NA,,Gov.iebookmark_bordersharemore_vert
Aquaculture,Northern Territory,2,Government approves NT prawn aquaculture facility,Neutral,,FOOD Magazine - Australiabookmark_bordersharemore_vert
Aquaculture,Victoria,0,"Government grants to support Australian ingenuity and create jobs | Ministers for the Department of Industry, Science, Energy and Resources",NA,,"Minister for Industry, Science25 Augbookmark_bordersharemore_vert"
Aquaculture,New South Wales,0,"Government grants to support Australian ingenuity and create jobs | Ministers for the Department of Industry, Science, Energy and Resources",NA,,"Minister for Industry, Science25 Augbookmark_bordersharemore_vert"
Aquaculture,Western Australia,0,"Government grants to support Australian ingenuity and create jobs | Ministers for the Department of Industry, Science, Energy and Resources",NA,,"Minister for Industry, Science25 Augbookmark_bordersharemore_vert"
Aquaculture,Australian Capital Territory,0,Governor Lamont Signs Legislation Supporting Continued Growth of Connecticut's Shellfish Industry,NA,,CT.gov23 Julybookmark_bordersharemore_vert
Aquaculture,South Australia,2,Greece is the word when it comes to aquaculture,Neutral,,SeaWestNews10 Augbookmark_bordersharemore_vert
Aquaculture,Tasmania,1,Greens label decision by incomplete fish farm panel in Tasmania an 'outrage'ABC Newsbookmark_bordersharemore_vert,Negative,,NAGreens label decision by incomplete fish farm panel in Tasmania an 'outrage'ABC Newsbookmark_bordersharemore_vert
Aquaculture,Australian Capital Territory,0,Griggs lands aqua reform gig,NA,,The Fish Site6 Augbookmark_bordersharemore_vert
Aquaculture,Northern Territory,0,Groote Eylandt mapping study off NT coast finds diversity similar to Great Barrier Reef,NA,,ABC Newsbookmark_bordersharemore_vert
Aquaculture,South Australia,0,Hagen Stehr: SA’s big fish on the secrets of his success,NA,,The Advertiserbookmark_bordersharemore_vert
Aquaculture,Western Australia,3,Hatch hires shellfish expert to support Irish aquaculture,Positive,,The Fish Site19 May 2021bookmark_bordersharemore_vert
Aquaculture,Northern Territory,0,Here's four major northern ag developments that have gained momentum recently,NA,,Beef Central23 Septbookmark_bordersharemore_vert
Aquaculture,Western Australia,0,Here's four major northern ag developments that have gained momentum recently,NA,,Beef Central23 Septbookmark_bordersharemore_vert
Aquaculture,South Australia,2,Hiramasa Kingfish: SA's aquaculture monarch,Neutral,,The Adelaide Reviewbookmark_bordersharemore_vert
Aquaculture,Tasmania,2,Hobart Town Hall Meeting on Salmon Farming,Neutral,,Tasmanian Times14 Novbookmark_bordersharemore_vert
Aquaculture,Queensland,2,Hong Kong investor buys axed Qld government fish breeding project and picks up the profits,Neutral,,ABC Newsbookmark_bordersharemore_vert
Aquaculture,Australian Capital Territory,0,"How FG spent about N56.9bn on women, youths in 2021 fiscal year",NA,,NIGERIAN TRIBUNE19 hours agobookmark_bordersharemore_vert
Aquaculture,Western Australia,0,How much do marine heatwaves cost? The economic losses amount to billions and billions of dollars,NA,,The Conversation AU26 Octbookmark_bordersharemore_vert
Aquaculture,Tasmania,1,How salmon farming pushed Macquarie Harbour to the limit,Negative,,ABC Onlinebookmark_bordersharemore_vert
Aquaculture,Tasmania,1,How Tasmania's salmon farms are being cleaned up by author Richard Flanagan,Negative,,Sydney Morning Herald26 Julybookmark_bordersharemore_vert
Aquaculture,Victoria,1,How Tasmania's salmon farms are being cleaned up by author Richard Flanagan,Negative,,Sydney Morning Herald26 Julybookmark_bordersharemore_vert
Aquaculture,New South Wales,1,How Tasmania's salmon farms are being cleaned up by author Richard Flanagan,Negative,,Sydney Morning Herald26 Julybookmark_bordersharemore_vert
Aquaculture,South Australia,3,How to start fish farming in just 10 easy steps,Positive,,Food For Mzansi8 June 2021bookmark_bordersharemore_vert
Aquaculture,Victoria,0,Huge boost for flathead stocks in NSW South Coast fishing havens!,NA,,Fishing World18 Mar 2021bookmark_bordersharemore_vert
Aquaculture,New South Wales,0,Huge boost for flathead stocks in NSW South Coast fishing havens!,NA,,Fishing World18 Mar 2021bookmark_bordersharemore_vert
Aquaculture,Victoria,2,Huon Aquaculture and NSW DPI transfer yellowtail kingfish into sea pens off Port Stephens,Neutral,,Port Stephens Examinerbookmark_bordersharemore_vert
Aquaculture,New South Wales,2,Huon Aquaculture and NSW DPI transfer yellowtail kingfish into sea pens off Port Stephens,Neutral,,Port Stephens Examinerbookmark_bordersharemore_vert
Aquaculture,Tasmania,2,Huon Aquaculture bosses expect investments will pay off,Neutral,,Tasmania Examiner28 Septbookmark_bordersharemore_vert
Aquaculture,Tasmania,1,"Huon Aquaculture confirms 120,000 salmon escaped in May storms, amid calls for more industry 'transparency'ABC Newsbookmark_bordersharemore_vert",Negative,,"NAHuon Aquaculture confirms 120,000 salmon escaped in May storms, amid calls for more industry 'transparency'ABC Newsbookmark_bordersharemore_vert"
Aquaculture,Tasmania,1,Huon Aquaculture defends itself from #Fresh,Negative,,ApproachToSalmon campaignSeafoodSourcebookmark_bordersharemore_vert
Aquaculture,Tasmania,2,Huon Aquaculture opens Perth processing facility as first step west for Tasmanian seafood giant,Neutral,,ABC News23 Jan 2021bookmark_bordersharemore_vert
Aquaculture,Queensland,2,Huon Aquaculture opens Perth processing facility as first step west for Tasmanian seafood giant,Neutral,,ABC News23 Jan 2021bookmark_bordersharemore_vert
Aquaculture,South Australia,2,Huon Aquaculture opens Perth processing facility as first step west for Tasmanian seafood giant,Neutral,,ABC News23 Jan 2021bookmark_bordersharemore_vert
Aquaculture,Victoria,2,Huon Aquaculture opens Perth processing facility as first step west for Tasmanian seafood giant,Neutral,,ABC News23 Jan 2021bookmark_bordersharemore_vert
Aquaculture,New South Wales,2,Huon Aquaculture opens Perth processing facility as first step west for Tasmanian seafood giant,Neutral,,ABC News23 Jan 2021bookmark_bordersharemore_vert
Aquaculture,Northern Territory,2,Huon Aquaculture opens Perth processing facility as first step west for Tasmanian seafood giant,Neutral,,ABC News23 Jan 2021bookmark_bordersharemore_vert
Aquaculture,Western Australia,2,Huon Aquaculture opens Perth processing facility as first step west for Tasmanian seafood giant,Neutral,,ABC News23 Jan 2021bookmark_bordersharemore_vert
Aquaculture,Tasmania,2,Huon Aquaculture takes Tasmanian Government to court over salmon farming in Macquarie Harbour,Neutral,,ABC Onlinebookmark_bordersharemore_vert
Aquaculture,Victoria,2,Huon Aquaculture takes Tasmanian Government to court over salmon farming in Macquarie Harbour,Neutral,,ABC Onlinebookmark_bordersharemore_vert
Aquaculture,New South Wales,2,Huon Aquaculture takes Tasmanian Government to court over salmon farming in Macquarie Harbour,Neutral,,ABC Onlinebookmark_bordersharemore_vert
Aquaculture,Tasmania,2,Huon Aquaculture talks down prospects of moving salmon farming entirely onshore in Tasmania,Neutral,,The Advocate20 June 2021bookmark_bordersharemore_vert
Aquaculture,Queensland,3,"Huon Aquaculture's revenue grew, but the salmon grower still took a hit due to COVID-19",Positive,,ABC Newsbookmark_bordersharemore_vert
Aquaculture,Victoria,1,Huon pulls plug on controversial Port Stephens kingfish farm,Negative,,The Sydney Morning Heraldbookmark_bordersharemore_vert
Aquaculture,New South Wales,1,Huon pulls plug on controversial Port Stephens kingfish farm,Negative,,The Sydney Morning Heraldbookmark_bordersharemore_vert
Aquaculture,Australian Capital Territory,2,ICES publishes first aquaculture report,Neutral,,The Fish Site24 Decbookmark_bordersharemore_vert
Aquaculture,Queensland,3,Iconic Queensland fish and shellfish farm offered for sale,Positive,,The Fish Site5 Octbookmark_bordersharemore_vert
Aquaculture,Western Australia,0,Immerse yourself in the great outdoors,NA,,Farm Weekly18 Decbookmark_bordersharemore_vert
Aquaculture,Australian Capital Territory,3,In photos: Land-based aquaculture promises more sustainable seafood,Positive,,Financial Times30 Novbookmark_bordersharemore_vert
Aquaculture,South Australia,2,"In the wake of major merger, Nireus earns “Fish from Greece” certification",Neutral,,SeafoodSourcebookmark_bordersharemore_vert
Aquaculture,Australian Capital Territory,3,Initiative launched to develop Lake Victoria's aquaculture sector,Positive,,The Fish Site19 Jan 2021bookmark_bordersharemore_vert
Aquaculture,Victoria,2,Inland fish farming at Murray Cod Farm in New South Wales,Neutral,,Irish Farmers Journal26 Julybookmark_bordersharemore_vert
Aquaculture,New South Wales,2,Inland fish farming at Murray Cod Farm in New South Wales,Neutral,,Irish Farmers Journal26 Julybookmark_bordersharemore_vert
Aquaculture,Queensland,2,Innovative Aquaculture Hub - Bribie Island,Neutral,,Your Neighbourhoodbookmark_bordersharemore_vert
Aquaculture,Australian Capital Territory,2,"Japan aims to boost aquaculture exports amid lagging production, declining domestic consumption",Neutral,,SeafoodSource30 Septbookmark_bordersharemore_vert
Aquaculture,Western Australia,2,Japan targets yellowtail exports boost as competition increases abroad,Neutral,,SeafoodSource24 Novbookmark_bordersharemore_vert
Aquaculture,South Australia,2,JBS' $425 MIllion Acquisition of Huon Aquaculture – Global Legal Chronicle,Neutral,,Global Legal Chronicle2 Decbookmark_bordersharemore_vert
Aquaculture,Tasmania,2,JBS boss promises no job losses if the meat processor takes over Huon Aquaculture,Neutral,,ABC News2 Septbookmark_bordersharemore_vert
Aquaculture,Western Australia,2,JBS counters Twiggy's animal welfare attack,Neutral,,Beef Central26 Augbookmark_bordersharemore_vert
Aquaculture,Queensland,2,"JBS takeover of Huon points to maturing Aussie aquaculture industry, but risks lurk beneath",Neutral,,ABC News2 Novbookmark_bordersharemore_vert
Aquaculture,South Australia,2,"JBS takeover of Huon points to maturing Aussie aquaculture industry, but risks lurk beneath",Neutral,,ABC News2 Novbookmark_bordersharemore_vert
Aquaculture,Victoria,2,"JBS takeover of Huon points to maturing Aussie aquaculture industry, but risks lurk beneath",Neutral,,ABC News2 Novbookmark_bordersharemore_vert
Aquaculture,New South Wales,2,"JBS takeover of Huon points to maturing Aussie aquaculture industry, but risks lurk beneath",Neutral,,ABC News2 Novbookmark_bordersharemore_vert
Aquaculture,Northern Territory,2,"JBS takeover of Huon points to maturing Aussie aquaculture industry, but risks lurk beneath",Neutral,,ABC News2 Novbookmark_bordersharemore_vert
Aquaculture,Western Australia,2,"JBS takeover of Huon points to maturing Aussie aquaculture industry, but risks lurk beneath",Neutral,,ABC News2 Novbookmark_bordersharemore_vert
Aquaculture,Tasmania,3,JBS's Aussie aquaculture investment provides 'platform for new global growth'Beef Central18 Augbookmark_bordersharemore_vert,Positive,,NAJBS's Aussie aquaculture investment provides 'platform for new global growth'Beef Central18 Augbookmark_bordersharemore_vert
Aquaculture,Queensland,3,JBS's Aussie aquaculture investment provides 'platform for new global growth'Beef Central18 Augbookmark_bordersharemore_vert,Positive,,NAJBS's Aussie aquaculture investment provides 'platform for new global growth'Beef Central18 Augbookmark_bordersharemore_vert
Aquaculture,South Australia,3,JBS's Aussie aquaculture investment provides 'platform for new global growth'Beef Central18 Augbookmark_bordersharemore_vert,Positive,,NAJBS's Aussie aquaculture investment provides 'platform for new global growth'Beef Central18 Augbookmark_bordersharemore_vert
Aquaculture,Victoria,3,JBS's Aussie aquaculture investment provides 'platform for new global growth'Beef Central18 Augbookmark_bordersharemore_vert,Positive,,NAJBS's Aussie aquaculture investment provides 'platform for new global growth'Beef Central18 Augbookmark_bordersharemore_vert
Aquaculture,New South Wales,3,JBS's Aussie aquaculture investment provides 'platform for new global growth'Beef Central18 Augbookmark_bordersharemore_vert,Positive,,NAJBS's Aussie aquaculture investment provides 'platform for new global growth'Beef Central18 Augbookmark_bordersharemore_vert
Aquaculture,Western Australia,3,JBS's Aussie aquaculture investment provides 'platform for new global growth'Beef Central18 Augbookmark_bordersharemore_vert,Positive,,NAJBS's Aussie aquaculture investment provides 'platform for new global growth'Beef Central18 Augbookmark_bordersharemore_vert
Aquaculture,Queensland,0,Jobs of the future: The changing face of our next farmers,NA,,Courier Mail16 Decbookmark_bordersharemore_vert
Aquaculture,Victoria,0,Jobs of the future: The changing face of our next farmers,NA,,Courier Mail16 Decbookmark_bordersharemore_vert
Aquaculture,New South Wales,0,Jobs of the future: The changing face of our next farmers,NA,,Courier Mail16 Decbookmark_bordersharemore_vert
Aquaculture,Northern Territory,0,Journo shines spotlight on ‘secretive’ industry,NA,,The Mercury10 Octbookmark_bordersharemore_vert
Aquaculture,Queensland,0,Katters propose Qld seafood label laws,NA,,The Canberra Times27 Octbookmark_bordersharemore_vert
Aquaculture,Northern Territory,0,Katters propose Qld seafood label laws,NA,,The Canberra Times27 Octbookmark_bordersharemore_vert
Aquaculture,Australian Capital Territory,0,Katters propose Qld seafood label laws,NA,,The Canberra Times27 Octbookmark_bordersharemore_vert
Aquaculture,Queensland,2,Keeping males in fridge – future of Aquaculture,Neutral,,Mirage News8 Decbookmark_bordersharemore_vert
Aquaculture,Northern Territory,2,Keeping males in fridge – future of Aquaculture,Neutral,,Mirage News8 Decbookmark_bordersharemore_vert
Aquaculture,Western Australia,2,Keeping males in fridge – future of Aquaculture,Neutral,,Mirage News8 Decbookmark_bordersharemore_vert
Aquaculture,Australian Capital Territory,3,"Kelly: Aquaculture safe, sustainable way to boost U.",Positive,,S. seafood productionBoston Herald26 Novbookmark_bordersharemore_vert
Aquaculture,Victoria,0,Kevin Mason's backyard becomes battleground for Aboriginal fishing rights,NA,,ABC News15 Septbookmark_bordersharemore_vert
Aquaculture,New South Wales,0,Kevin Mason's backyard becomes battleground for Aboriginal fishing rights,NA,,ABC News15 Septbookmark_bordersharemore_vert
Aquaculture,Tasmania,2,KI aquaculture expansion back on after timber port rejection,Neutral,,InDaily10 Septbookmark_bordersharemore_vert
Aquaculture,South Australia,2,KI aquaculture expansion back on after timber port rejection,Neutral,,InDaily10 Septbookmark_bordersharemore_vert
Aquaculture,Victoria,2,"La Nina brings unfavourable weather for oyster growers, some fear they won't meet high Christmas demand",Neutral,,ABC News8 Decbookmark_bordersharemore_vert
Aquaculture,New South Wales,2,"La Nina brings unfavourable weather for oyster growers, some fear they won't meet high Christmas demand",Neutral,,ABC News8 Decbookmark_bordersharemore_vert
Aquaculture,Northern Territory,0,Land clearing changes slash approval times by months,NA,,NT News26 Mar 2021bookmark_bordersharemore_vert
Aquaculture,Tasmania,1,Landing salmon: can Tasmania clean up the industry by bringing it onshore?,Negative,,The Guardian Australia5 Septbookmark_bordersharemore_vert
Aquaculture,Australian Capital Territory,0,Liberia: Africa Rice Ends First-Ever Integrated Rice-Fish Farming Training in South-East Liberia,NA,,AllAfrica.com24 Decbookmark_bordersharemore_vert
Aquaculture,Australian Capital Territory,3,Linking agriculture with fish farming can help feed the world. Here’s how,Positive,,ThePrint23 Augbookmark_bordersharemore_vert
Aquaculture,Queensland,2,"Lockyer Valley farmers introduce aquaculture and ""pasture raised"" poultry",Neutral,,Queensland Country Life26 Julybookmark_bordersharemore_vert
Aquaculture,Tasmania,2,Loss-making Huon is potential takeover target – Fish Farmer Magazine,Neutral,,Fish Farmer Magazine1 Mar 2021bookmark_bordersharemore_vert
Aquaculture,Queensland,0,Mackay Whitsunday schools get $1.5m worth of upgrades,NA,,Courier Mail7 May 2021bookmark_bordersharemore_vert
Aquaculture,Queensland,3,Mackay-Whitsunday aquaculture projects to net up to 1000 jobs,Positive,,Mirage Newsbookmark_bordersharemore_vert
Aquaculture,Tasmania,1,Macquarie Harbour recovers from rapid salmon expansion as EPA considers future sustainability,Negative,,ABC News5 Decbookmark_bordersharemore_vert
Aquaculture,Northern Territory,1,Macquarie Harbour recovers from rapid salmon expansion as EPA considers future sustainability,Negative,,ABC News5 Decbookmark_bordersharemore_vert
Aquaculture,Western Australia,0,Major defence for WA biosecurity,NA,,Farm Weekly2 Novbookmark_bordersharemore_vert
Aquaculture,Western Australia,0,Mandurah fine issued over illegal shellfish,NA,,Mandurah Mailbookmark_bordersharemore_vert
Aquaculture,Queensland,3,Mangrove aquaculture to be supported by state-of-the-art environmental monitoring,Positive,,The Fish Site19 Jan 2021bookmark_bordersharemore_vert
Aquaculture,Western Australia,0,Margaret River wineries celebrate their stunning surrounds,NA,,Gourmet Traveller30 Novbookmark_bordersharemore_vert
Aquaculture,Tasmania,2,Marine Aquaculture Research Bill out for public comment,Neutral,,Premier of Tasmania20 Octbookmark_bordersharemore_vert
Aquaculture,Australian Capital Territory,2,Marine Aquaculture Research Bill out for public comment,Neutral,,Premier of Tasmania20 Octbookmark_bordersharemore_vert
Aquaculture,Queensland,2,MBD purchase and expand prawn and seaweed facility,Neutral,,North Queensland Registerbookmark_bordersharemore_vert
Aquaculture,South Australia,2,Meat Giant JBS to Enter Fish Market With $314 Million Huon Deal,Neutral,,Bloomberg6 Augbookmark_bordersharemore_vert
Aquaculture,Western Australia,0,Media statements - Agrifood and beverage vouchers backing regional businesses,NA,,Media Statements1 Octbookmark_bordersharemore_vert
Aquaculture,Western Australia,3,"Media statements - Albany Aquaculture Zone to boost investment, growth and jobs",Positive,,Media Statements2 Decbookmark_bordersharemore_vert
Aquaculture,Western Australia,0,Media statements - Community support to stop new exotic pest,NA,,Media Statements22 Septbookmark_bordersharemore_vert
Aquaculture,Western Australia,0,Media statements - Consultation underway on new marine park for the south coast,NA,,Media Statements24 Septbookmark_bordersharemore_vert
Aquaculture,Western Australia,0,Media statements - Don't send unwanted pests in the mail this Christmas,NA,,Media Statements8 Decbookmark_bordersharemore_vert
Aquaculture,Western Australia,0,Media statements - New chair appointed to Mid West Development Commission,NA,,Media Statements21 Decbookmark_bordersharemore_vert
Aquaculture,Western Australia,0,Media statements - New research facilities to support jobs and grow aquaculture industry,NA,,Media Statements28 Jan 2021bookmark_bordersharemore_vert
Aquaculture,Western Australia,0,Media statements - WA's commercial fishing industry honours its champions,NA,,Media Statements13 Augbookmark_bordersharemore_vert
Aquaculture,South Australia,3,Methane-busting seaweed industry begins growing in South Australia,Positive,,InDaily30 Julybookmark_bordersharemore_vert
Aquaculture,Northern Territory,0,Milking it: Behind Twiggy’s surprise bet on Aussie favourites,NA,,NT News10 days agobookmark_bordersharemore_vert
Aquaculture,Northern Territory,0,Mining company TNG scraps Darwin Harbour discharge plan after Paspaley pressure,NA,,ABC News7 Apr 2021bookmark_bordersharemore_vert
Aquaculture,Western Australia,0,Minister gives recreational fishers a hand releasing future catches,NA,,Media Statements13 May 2021bookmark_bordersharemore_vert
Aquaculture,Australian Capital Territory,0,"Minister of Fisheries, Oceans and the Canadian Coast Guard Mandate Letter",NA,,Prime Minister of Canada16 Decbookmark_bordersharemore_vert
Aquaculture,Tasmania,1,Minister refuses to shed light on why two experts quit Tasmanian fish farm advisory panel,Negative,,ABC Newsbookmark_bordersharemore_vert
Aquaculture,Northern Territory,0,Monsoon Aquatics wins Australian Exporter of the Year Award,NA,,ABC News26 Novbookmark_bordersharemore_vert
Aquaculture,Victoria,0,More flatties stocked on the NSW South Coast,NA,,Fishing World26 Mar 2021bookmark_bordersharemore_vert
Aquaculture,New South Wales,0,More flatties stocked on the NSW South Coast,NA,,Fishing World26 Mar 2021bookmark_bordersharemore_vert
Aquaculture,Australian Capital Territory,2,Most Canadian aquaculture fisheries meet new U.,Neutral,,S. standard for wildlife protectionCBC.ca1 Decbookmark_bordersharemore_vert
Aquaculture,Australian Capital Territory,2,"Most Canadians support ocean-based salmon farming, aquaculture",Neutral,,SeaWestNews18 Novbookmark_bordersharemore_vert
Aquaculture,Northern Territory,0,Most NT public servants vaccinated as deadline for staff to be stood down looms,NA,,The Mandarin16 Novbookmark_bordersharemore_vert
Aquaculture,Tasmania,2,MOU to support aquaculture further offshore,Neutral,,Premier of Tasmania27 Septbookmark_bordersharemore_vert
Aquaculture,Queensland,0,Mount Morgan Regional Community Forum tomorrow - Ministerial Media Statements,NA,,Media Statements26 Septbookmark_bordersharemore_vert
Aquaculture,Australian Capital Territory,2,Mowi fined NOK 800000 over breach of ISA rules – Fish Farmer Magazine,Neutral,,Fish Farmer Magazine6 Septbookmark_bordersharemore_vert
Aquaculture,Australian Capital Territory,2,"Mowi Ireland gets go-ahead for Irish farming license, over NGO objections",Neutral,,SeafoodSource5 Augbookmark_bordersharemore_vert
Aquaculture,Australian Capital Territory,2,"Mowi praised, Cooke lambasted in seafood sustainability rankings",Neutral,,The Fish Site13 Octbookmark_bordersharemore_vert
Aquaculture,Victoria,2,Murray cod farmer raises $30 million,Neutral,,The Fish Site15 Novbookmark_bordersharemore_vert
Aquaculture,New South Wales,2,Murray cod farmer raises $30 million,Neutral,,The Fish Site15 Novbookmark_bordersharemore_vert
Aquaculture,Victoria,0,National sustainable seafood recognition for Fairy Meadow business Harley & Johns,NA,,Illawarra Mercury9 Mar 2021bookmark_bordersharemore_vert
Aquaculture,New South Wales,0,National sustainable seafood recognition for Fairy Meadow business Harley & Johns,NA,,Illawarra Mercury9 Mar 2021bookmark_bordersharemore_vert
Aquaculture,Tasmania,0,Navigator a boost to sea training and jobs,NA,,Premier of Tasmania11 Augbookmark_bordersharemore_vert
Aquaculture,Queensland,2,New $2.5m aquaculture facility planned for Rockhampton school,Neutral,,Courier Mail28 Septbookmark_bordersharemore_vert
Aquaculture,Victoria,2,New $2.5m aquaculture facility planned for Rockhampton school,Neutral,,Courier Mail28 Septbookmark_bordersharemore_vert
Aquaculture,New South Wales,2,New $2.5m aquaculture facility planned for Rockhampton school,Neutral,,Courier Mail28 Septbookmark_bordersharemore_vert
Aquaculture,Northern Territory,2,New $2.5m aquaculture facility planned for Rockhampton school,Neutral,,Courier Mail28 Septbookmark_bordersharemore_vert
