System,State,Sentiment_1_RAW,Headline,Sentiment_1,Sentiment_2,Metadata
Aquaculture,Northern Territory,0,New $4.6m tree project will see Tiwi revenue soar,NA,,National Indigenous Times10 Septbookmark_bordersharemore_vert
Aquaculture,Queensland,3,New abalone restrictions to protect South Australian industry,Positive,,Premier of South Australia27 May 2021bookmark_bordersharemore_vert
Aquaculture,South Australia,3,New abalone restrictions to protect South Australian industry,Positive,,Premier of South Australia27 May 2021bookmark_bordersharemore_vert
Aquaculture,Victoria,3,New abalone restrictions to protect South Australian industry,Positive,,Premier of South Australia27 May 2021bookmark_bordersharemore_vert
Aquaculture,New South Wales,3,New abalone restrictions to protect South Australian industry,Positive,,Premier of South Australia27 May 2021bookmark_bordersharemore_vert
Aquaculture,Northern Territory,3,New abalone restrictions to protect South Australian industry,Positive,,Premier of South Australia27 May 2021bookmark_bordersharemore_vert
Aquaculture,Western Australia,0,New DPIRD challenge for frost researcher,NA,,Farm Weekly2 Decbookmark_bordersharemore_vert
Aquaculture,Australian Capital Territory,0,New Fisheries Act is being drafted to regulate sector - Hawa Koomson,NA,,Myjoyonline13 Septbookmark_bordersharemore_vert
Aquaculture,Northern Territory,2,New Huon chief reveals future of business,Neutral,,The Mercury12 Novbookmark_bordersharemore_vert
Aquaculture,Western Australia,2,New Huon chief reveals future of business,Neutral,,The Mercury12 Novbookmark_bordersharemore_vert
Aquaculture,Western Australia,0,New leaders at Harvest Road,NA,,Farm Weekly20 Octbookmark_bordersharemore_vert
Aquaculture,Northern Territory,3,New NT trepang farm targets world markets,Positive,,NT News17 Feb 2021bookmark_bordersharemore_vert
Aquaculture,Australian Capital Territory,2,New prawn feed trial offers sustainable alternative,Neutral,,North Queensland Register11 Novbookmark_bordersharemore_vert
Aquaculture,Queensland,0,New reef regulations coming in June,NA,,Queensland Country Life24 May 2021bookmark_bordersharemore_vert
Aquaculture,Western Australia,2,New research suggests that human food waste could be a sustainable source of aquafeed,Neutral,,The Fish Site2 Apr 2021bookmark_bordersharemore_vert
Aquaculture,Victoria,3,"New salmon, prawn products making waves in Australia, including latest Huon range",Positive,,SeafoodSourcebookmark_bordersharemore_vert
Aquaculture,New South Wales,3,"New salmon, prawn products making waves in Australia, including latest Huon range",Positive,,SeafoodSourcebookmark_bordersharemore_vert
Aquaculture,Western Australia,0,New study reveals history of Aboriginal trade with foreign visitors before British settlement,NA,,ABC News18 Julybookmark_bordersharemore_vert
Aquaculture,Tasmania,2,New Tasmanian Seafood Processor Grant Scheme,Neutral,,Premier of Tasmania6 Augbookmark_bordersharemore_vert
Aquaculture,South Australia,3,New taste to fish farming in Australia,Positive,,InDailybookmark_bordersharemore_vert
Aquaculture,Australian Capital Territory,2,Ngāi Tahu now has scope for aquaculture farming in Murihiku,Neutral,,Stuff.co.nz5 Octbookmark_bordersharemore_vert
Aquaculture,Northern Territory,2,"Nicole Manison: The NT's new Minister for Agribusiness, Aquaculture, Mining, Industry, Trade and more",Neutral,,ABC Newsbookmark_bordersharemore_vert
Aquaculture,Australian Capital Territory,0,Nine contenders in the running for $100000 F3 Challenge prize,NA,,The Fish Site10 Novbookmark_bordersharemore_vert
Aquaculture,Northern Territory,0,NLC defends new registration process for anglers in NT waters,NA,,ABC News1 Mar 2021bookmark_bordersharemore_vert
Aquaculture,Australian Capital Territory,2,NOAA identifies prime places for aquaculture,Neutral,,The Fish Site17 Novbookmark_bordersharemore_vert
Aquaculture,South Australia,2,Nominate now for Yumbah Aquaculture Kangaroo Island employment awards,Neutral,,The Islander12 May 2021bookmark_bordersharemore_vert
Aquaculture,Northern Territory,2,Northern Australia Food Futures Conference 2021,Neutral,,FreshPlaza.com24 May 2021bookmark_bordersharemore_vert
Aquaculture,Northern Territory,2,Northern Territory Seafood Council welcomes north Australia aquaculture report,Neutral,,ABC Onlinebookmark_bordersharemore_vert
Aquaculture,Western Australia,2,"Northwest Aquaculture Alliance Adds Alaska Seafood Industry Veteran, Jeff Hetrick, to its Board of Directors",Neutral,,PerishableNews20 Decbookmark_bordersharemore_vert
Aquaculture,Queensland,3,Not just for sushi: The push to farm seaweed off Queensland,Positive,,ABC Onlinebookmark_bordersharemore_vert
Aquaculture,Queensland,3,NQ freshwater aquaculture opportunity,Positive,,Queensland Country Life12 Julybookmark_bordersharemore_vert
Aquaculture,Australian Capital Territory,3,NQ freshwater aquaculture opportunity,Positive,,Queensland Country Life12 Julybookmark_bordersharemore_vert
Aquaculture,Victoria,0,NSW authorities slap more penalties on non-compliant fishing,NA,,The Mandarin3 Septbookmark_bordersharemore_vert
Aquaculture,New South Wales,0,NSW authorities slap more penalties on non-compliant fishing,NA,,The Mandarin3 Septbookmark_bordersharemore_vert
Aquaculture,Victoria,3,NSW DPI and Huon Aquaculture plan to breathe new life into defunct Pisces fish farm off Port Stephens,Positive,,Port Stephens Examinerbookmark_bordersharemore_vert
Aquaculture,New South Wales,3,NSW DPI and Huon Aquaculture plan to breathe new life into defunct Pisces fish farm off Port Stephens,Positive,,Port Stephens Examinerbookmark_bordersharemore_vert
Aquaculture,Northern Territory,2,NT set to double nation's prawn production,Neutral,,The Courier26 Julybookmark_bordersharemore_vert
Aquaculture,Northern Territory,2,NT set to double nation's prawn production7,Neutral,,NEWS.com.au26 Julybookmark_bordersharemore_vert
Aquaculture,Northern Territory,0,NT water sustainability research to guide federal planning,NA,,The Mandarin20 Octbookmark_bordersharemore_vert
Aquaculture,South Australia,0,"Obituary - William L. Shelton, 1939-2021 - World Aquaculture Societywas.org16 Decbookmark_bordersharemore_vert",NA,,"NAObituary - William L. Shelton, 1939-2021 - World Aquaculture Societywas.org16 Decbookmark_bordersharemore_vert"
Aquaculture,Tasmania,2,"Off shore salmon farming has potential, says Senator Peter Whish-Wilson",Neutral,,The Advocate3 Novbookmark_bordersharemore_vert
Aquaculture,Australian Capital Territory,2,Offshore aquaculture legislation reaches US Senate,Neutral,,The Fish Site29 Octbookmark_bordersharemore_vert
Aquaculture,Tasmania,2,Offshore marine aquaculture research a step closer,Neutral,,Premier of Tasmania24 Novbookmark_bordersharemore_vert
Aquaculture,Australian Capital Territory,2,Offshore marine aquaculture research a step closer,Neutral,,Premier of Tasmania24 Novbookmark_bordersharemore_vert
Aquaculture,Australian Capital Territory,3,Opinion : America has an opportunity in aquaculture. Congress needs to act.,Positive,,The Virginian-Pilot7 June 2021Opinionbookmark_bordersharemore_vert
Aquaculture,Australian Capital Territory,3,"Opinion: Aquaculture is a safe, sustainable complement to the U.",Positive,,S. fishing industryAgri-Pulse11 NovOpinionbookmark_bordersharemore_vert
Aquaculture,Australian Capital Territory,1,Opinion: Aquaculture still in its infant stages 18 years later,Negative,,New Era9 AugOpinionbookmark_bordersharemore_vert
Aquaculture,Australian Capital Territory,2,Ottawa making waves with plans for an aquaculture act,Neutral,,National Observer24 Feb 2021bookmark_bordersharemore_vert
Aquaculture,Northern Territory,3,"Oyster farming milestone for remote Aboriginal community, as 80,000 baby oysters touch down",Positive,,ABC Newsbookmark_bordersharemore_vert
Aquaculture,Western Australia,0,Oyster Harbour seasonal closure set to continue after wastewater leak,NA,,ABC News24 Augbookmark_bordersharemore_vert
Aquaculture,Queensland,3,Pacific Reef Fisheries Guthalungra prawn farm progresses,Positive,,North Queensland Registerbookmark_bordersharemore_vert
Aquaculture,Northern Territory,0,Pacific workers fly into Darwin for mango season,NA,,NT News31 Augbookmark_bordersharemore_vert
Aquaculture,Tasmania,2,Peace in salmon war lies on the land,Neutral,,The Mercury21 AugOpinionbookmark_bordersharemore_vert
Aquaculture,Northern Territory,2,Peace in salmon war lies on the land,Neutral,,The Mercury21 AugOpinionbookmark_bordersharemore_vert
Aquaculture,Queensland,2,Peak body launched for seaweed industry,Neutral,,Food & Drink Business11 Augbookmark_bordersharemore_vert
Aquaculture,Western Australia,0,Peeling back the layers of food and beverage producers in the region,NA,,Government of Western Australia1 Novbookmark_bordersharemore_vert
Aquaculture,Tasmania,2,Plan for deep-water fish pens off Tasmania7,Neutral,,NEWS27 Septbookmark_bordersharemore_vert
Aquaculture,Queensland,2,Plan for deep-water fish pens off Tasmania7,Neutral,,NEWS27 Septbookmark_bordersharemore_vert
Aquaculture,South Australia,2,Plan for deep-water fish pens off Tasmania7,Neutral,,NEWS27 Septbookmark_bordersharemore_vert
Aquaculture,Victoria,2,Plan for deep-water fish pens off Tasmania7,Neutral,,NEWS27 Septbookmark_bordersharemore_vert
Aquaculture,New South Wales,2,Plan for deep-water fish pens off Tasmania7,Neutral,,NEWS27 Septbookmark_bordersharemore_vert
Aquaculture,Northern Territory,2,Plan for deep-water fish pens off Tasmania7,Neutral,,NEWS27 Septbookmark_bordersharemore_vert
Aquaculture,Western Australia,2,Plan for deep-water fish pens off Tasmania7,Neutral,,NEWS27 Septbookmark_bordersharemore_vert
Aquaculture,Queensland,0,Plenty of Queensland seafood this Christmas,NA,,Noosa Today11 Decbookmark_bordersharemore_vert
Aquaculture,Victoria,1,Poor maintenance blamed for mass escape of farmed kingfish,Negative,,ABC Newsbookmark_bordersharemore_vert
Aquaculture,New South Wales,1,Poor maintenance blamed for mass escape of farmed kingfish,Negative,,ABC Newsbookmark_bordersharemore_vert
Aquaculture,Western Australia,0,Port Hedland mayor ‘kept mum on his Indigenous links’The Australian14 Decbookmark_bordersharemore_vert,NA,,NAPort Hedland mayor ‘kept mum on his Indigenous links’The Australian14 Decbookmark_bordersharemore_vert
Aquaculture,South Australia,0,Port Lincoln City Council against desalination plant in Boston Bay,NA,,Port Lincoln Times17 Novbookmark_bordersharemore_vert
Aquaculture,South Australia,3,"Port Lincoln tuna farming outlook bright, Inquiry hears",Positive,,Port Lincoln Times2 Decbookmark_bordersharemore_vert
Aquaculture,Victoria,0,Power’s new passion project with an old mate,NA,,Sydney Morning Herald18 Augbookmark_bordersharemore_vert
Aquaculture,New South Wales,0,Power’s new passion project with an old mate,NA,,Sydney Morning Herald18 Augbookmark_bordersharemore_vert
Aquaculture,Western Australia,0,Power’s new passion project with an old mate,NA,,Sydney Morning Herald18 Augbookmark_bordersharemore_vert
Aquaculture,Northern Territory,3,Prawn farming plans in NT get a boost from Charles Darwin University,Positive,,Katherine Times30 Septbookmark_bordersharemore_vert
Aquaculture,Queensland,3,Prawns star in new record-high for aquaculture production,Positive,,Media Statements25 Feb 2021bookmark_bordersharemore_vert
Aquaculture,South Australia,2,Premium Australian oyster fishery returns to growth,Neutral,,The Lead South Australiabookmark_bordersharemore_vert
Aquaculture,Victoria,0,Primary production and rural development -NSW Department of Planning30 Apr 2021bookmark_bordersharemore_vert,NA,,NAPrimary production and rural development -NSW Department of Planning30 Apr 2021bookmark_bordersharemore_vert
Aquaculture,New South Wales,0,Primary production and rural development -NSW Department of Planning30 Apr 2021bookmark_bordersharemore_vert,NA,,NAPrimary production and rural development -NSW Department of Planning30 Apr 2021bookmark_bordersharemore_vert
Aquaculture,Queensland,0,Project pipeline taps into jobs and growth in Mackay,NA,,Media Statements9 Septbookmark_bordersharemore_vert
Aquaculture,Northern Territory,2,Project Sea Dragon managers confident major prawn farm will go ahead despite coronavirus delays,Neutral,,ABC Newsbookmark_bordersharemore_vert
Aquaculture,Western Australia,2,Project Sea Dragon managers confident major prawn farm will go ahead despite coronavirus delays,Neutral,,ABC Newsbookmark_bordersharemore_vert
Aquaculture,Northern Territory,2,Project Sea Dragon owner optimistic despite $25.8m loss,Neutral,,NT News1 Septbookmark_bordersharemore_vert
Aquaculture,Queensland,2,Project Sea Dragon reports significant progress,Neutral,,The Fish Site23 May 2021bookmark_bordersharemore_vert
Aquaculture,Northern Territory,2,Project Sea Dragon reports significant progress,Neutral,,The Fish Site23 May 2021bookmark_bordersharemore_vert
Aquaculture,Western Australia,2,Project Sea Dragon reports significant progress,Neutral,,The Fish Site23 May 2021bookmark_bordersharemore_vert
Aquaculture,Tasmania,2,Promising plans for a new salmon farm at Circular Head: Petuna CEO Ruben Alvarez,Neutral,,The Advocate21 June 2021bookmark_bordersharemore_vert
Aquaculture,Northern Territory,2,Property: Legune Station sale paves way for massive aquaculture project,Neutral,,Beef Centralbookmark_bordersharemore_vert
Aquaculture,Tasmania,0,Protesters demand UTAS to stay right where it is,NA,,The Mercury17 Decbookmark_bordersharemore_vert
Aquaculture,Western Australia,0,Push for Harvest Road to be carbon neutral ahead of 2030,NA,,The West Australian23 Decbookmark_bordersharemore_vert
Aquaculture,Victoria,2,Qld hub for northern aquaculture species,Neutral,,Goulburn Post27 Julybookmark_bordersharemore_vert
Aquaculture,New South Wales,2,Qld hub for northern aquaculture species,Neutral,,Goulburn Post27 Julybookmark_bordersharemore_vert
Aquaculture,Queensland,0,"Queensland fisheries face tighter regulations, but industry is not happy",NA,,ABC Newsbookmark_bordersharemore_vert
Aquaculture,Queensland,3,Queensland gropers sent to south-east to help prawn farmers battling white spot disease,Positive,,ABC Onlinebookmark_bordersharemore_vert
Aquaculture,Queensland,2,Queensland launches $5 million aquaculture hub,Neutral,,The Fish Site27 Julybookmark_bordersharemore_vert
Aquaculture,Queensland,2,"R&D grants open for fisheries, aquaculture",Neutral,,Food & Drink Business3 Decbookmark_bordersharemore_vert
Aquaculture,Western Australia,0,RASHA AL JUNDI - Diani's Changing Waters,NA,,The Elephant3 days agobookmark_bordersharemore_vert
Aquaculture,Australian Capital Territory,0,RE program for agri-fishery sector requires ₧8,NA,,B–BAFE | Jasper Y. ArcalasBusiness Mirror19 hours agobookmark_bordersharemore_vert
Aquaculture,Victoria,0,Recreational fishing access in water supply dams,NA,,Fishing World29 Apr 2021bookmark_bordersharemore_vert
Aquaculture,New South Wales,0,Recreational fishing access in water supply dams,NA,,Fishing World29 Apr 2021bookmark_bordersharemore_vert
Aquaculture,Australian Capital Territory,0,Report from the future: Aotearoa New Zealand is looking good in 2040 – here's how we did it,NA,,The Conversation AU7 days agobookmark_bordersharemore_vert
Aquaculture,Western Australia,0,Researchers scale up new blood test for stressed fish,NA,,Phys.org10 Augbookmark_bordersharemore_vert
Aquaculture,Tasmania,2,Ridley Corp sells aquafeed plant to Skretting,Neutral,,FeedNavigator.com25 May 2021bookmark_bordersharemore_vert
Aquaculture,Queensland,2,Ridley Corp sells aquafeed plant to Skretting,Neutral,,FeedNavigator.com25 May 2021bookmark_bordersharemore_vert
Aquaculture,Victoria,3,Riverina Murray cod farm a dam good idea,Positive,,The Weekly Timesbookmark_bordersharemore_vert
Aquaculture,New South Wales,3,Riverina Murray cod farm a dam good idea,Positive,,The Weekly Timesbookmark_bordersharemore_vert
Aquaculture,South Australia,3,SA aquaculture industry reaching new heights,Positive,,Premier of South Australia6 Septbookmark_bordersharemore_vert
Aquaculture,South Australia,3,SA Commercial Marine Scalefish Fishery celebrates 185 years of sustainability and family traditions,Positive,,ABC News20 Apr 2021bookmark_bordersharemore_vert
Aquaculture,Northern Territory,1,Salmon boss launches furious spray over ‘puerile’ video,Negative,,The Mercury20 Julybookmark_bordersharemore_vert
Aquaculture,Tasmania,2,Salmon farm admits fault over mass fish escape,Neutral,,The Mercurybookmark_bordersharemore_vert
Aquaculture,Queensland,2,Salmon farmer Huon Aquaculture slams accreditation scheme,Neutral,,The Australian6 Septbookmark_bordersharemore_vert
Aquaculture,Tasmania,1,Salmon farming giant Huon Aquaculture hit by another incident at fish pen in Tasmania,Negative,,ABC Newsbookmark_bordersharemore_vert
Aquaculture,Victoria,1,Salmon farming giant Huon Aquaculture hit by another incident at fish pen in Tasmania,Negative,,ABC Newsbookmark_bordersharemore_vert
Aquaculture,New South Wales,1,Salmon farming giant Huon Aquaculture hit by another incident at fish pen in Tasmania,Negative,,ABC Newsbookmark_bordersharemore_vert
Aquaculture,Northern Territory,1,Salmon farming giant Huon Aquaculture hit by another incident at fish pen in Tasmania,Negative,,ABC Newsbookmark_bordersharemore_vert
Aquaculture,Tasmania,1,Salmon Farming: Tasmania's Reset On Its Controversial Industry,Negative,,Junkee23 Septbookmark_bordersharemore_vert
Aquaculture,Tasmania,2,"Salmon giant Huon objects to Petuna Storm Bay farm licence on biosecurity grounds, documents show",Neutral,,ABC News5 Feb 2021bookmark_bordersharemore_vert
Aquaculture,Northern Territory,2,"Salmon giant Huon objects to Petuna Storm Bay farm licence on biosecurity grounds, documents show",Neutral,,ABC News5 Feb 2021bookmark_bordersharemore_vert
Aquaculture,Tasmania,1,"Salmon 'grow' and 'no grow' draft plan for Tasmania released, but Greens unimpressed",Negative,,ABC Onlinebookmark_bordersharemore_vert
Aquaculture,Tasmania,2,"Salmon industry winning the PR war, poll shows",Neutral,,The Mercury25 Decbookmark_bordersharemore_vert
Aquaculture,Tasmania,2,Salmon Wars: The path to a peace plan,Neutral,,The Mercury6 AugOpinionbookmark_bordersharemore_vert
Aquaculture,Queensland,2,Salmon Wars: The path to a peace plan,Neutral,,The Mercury6 AugOpinionbookmark_bordersharemore_vert
Aquaculture,South Australia,2,Salmon Wars: The path to a peace plan,Neutral,,The Mercury6 AugOpinionbookmark_bordersharemore_vert
Aquaculture,Northern Territory,2,Salmon Wars: The path to a peace plan,Neutral,,The Mercury6 AugOpinionbookmark_bordersharemore_vert
Aquaculture,Western Australia,2,Salmon Wars: The path to a peace plan,Neutral,,The Mercury6 AugOpinionbookmark_bordersharemore_vert
Aquaculture,Northern Territory,0,Satellite images predict the NT's next mango harvest yield,NA,,FOOD Magazine - Australia24 Septbookmark_bordersharemore_vert
Aquaculture,Australian Capital Territory,3,SATS pens letter to Biden urging support for aquaculture prioritization,Positive,,SeafoodSource25 May 2021bookmark_bordersharemore_vert
Aquaculture,Queensland,2,Seafarms secures $90 million funding,Neutral,,The Fish Site25 June 2021bookmark_bordersharemore_vert
Aquaculture,Northern Territory,2,Seafarms secures $90 million funding,Neutral,,The Fish Site25 June 2021bookmark_bordersharemore_vert
Aquaculture,Western Australia,2,Seafarms secures $90 million funding,Neutral,,The Fish Site25 June 2021bookmark_bordersharemore_vert
Aquaculture,Western Australia,2,Seafood and buy it: Twiggy's company set to swallow Albany oyster farm,Neutral,,The Sydney Morning Heraldbookmark_bordersharemore_vert
Aquaculture,Tasmania,2,"Seal response at Tasmanian aquaculture sites 'out of proportion', advocates say",Neutral,,ABC Newsbookmark_bordersharemore_vert
Aquaculture,South Australia,0,Search begins for SA's 2021 Ag,NA,,Town of the YearInDaily15 Julybookmark_bordersharemore_vert
Aquaculture,South Australia,2,Seaweed aquaculture venture to partner with Kangaroo Island oyster grower,Neutral,,The Islanderbookmark_bordersharemore_vert
Aquaculture,Australian Capital Territory,2,Senate Re-Introduction of AQUAA Act Could Be a Cause for Concern – Food Tank,Neutral,,Food Tankbookmark_bordersharemore_vert
Aquaculture,Western Australia,0,Senior management appointments strengthen WA's Harvest Road beef supply chain,NA,,Beef Central6 Octbookmark_bordersharemore_vert
Aquaculture,Victoria,2,Shellfish and seaweed aquaculture potential in Australia,Neutral,,Foodprocessingbookmark_bordersharemore_vert
Aquaculture,New South Wales,2,Shellfish and seaweed aquaculture potential in Australia,Neutral,,Foodprocessingbookmark_bordersharemore_vert
Aquaculture,Queensland,3,Shepparton fish farming course will help Indigenous students work on Country,Positive,,ABC News2 Augbookmark_bordersharemore_vert
Aquaculture,South Australia,3,Shepparton fish farming course will help Indigenous students work on Country,Positive,,ABC News2 Augbookmark_bordersharemore_vert
Aquaculture,Victoria,3,Shepparton fish farming course will help Indigenous students work on Country,Positive,,ABC News2 Augbookmark_bordersharemore_vert
Aquaculture,New South Wales,3,Shepparton fish farming course will help Indigenous students work on Country,Positive,,ABC News2 Augbookmark_bordersharemore_vert
Aquaculture,Northern Territory,3,Shepparton fish farming course will help Indigenous students work on Country,Positive,,ABC News2 Augbookmark_bordersharemore_vert
Aquaculture,Tasmania,1,'Shocking' images of birds caught in nets prompt calls for reform at Tasmanian salmon farms,Negative,,ABC Newsbookmark_bordersharemore_vert
Aquaculture,Tasmania,2,Skretting to buy Ridley's Tasmanian aquafeed plant,Neutral,,Grain Central21 June 2021bookmark_bordersharemore_vert
Aquaculture,Western Australia,0,Slaughter joins Harvest Road team,NA,,Farm Weeklybookmark_bordersharemore_vert
Aquaculture,Tasmania,0,Small scale farmer tackles ‘Toxic’ backwash,NA,,The Mercury26 June 2021bookmark_bordersharemore_vert
Aquaculture,Queensland,3,Social media influencers deemed 'a threat' to Australia's budding aquaculture industry,Positive,,ABC News20 Augbookmark_bordersharemore_vert
Aquaculture,Victoria,3,Social media influencers deemed 'a threat' to Australia's budding aquaculture industry,Positive,,ABC News20 Augbookmark_bordersharemore_vert
Aquaculture,New South Wales,3,Social media influencers deemed 'a threat' to Australia's budding aquaculture industry,Positive,,ABC News20 Augbookmark_bordersharemore_vert
Aquaculture,Northern Territory,3,Social media influencers deemed 'a threat' to Australia's budding aquaculture industry,Positive,,ABC News20 Augbookmark_bordersharemore_vert
Aquaculture,Western Australia,3,Social media influencers deemed 'a threat' to Australia's budding aquaculture industry,Positive,,ABC News20 Augbookmark_bordersharemore_vert
Aquaculture,Australian Capital Territory,3,Social media influencers deemed 'a threat' to Australia's budding aquaculture industry,Positive,,ABC News20 Augbookmark_bordersharemore_vert
Aquaculture,Queensland,3,Solid ground boosts NQ rock lobster farm - Ministerial Media Statements,Positive,,Media Statements3 Decbookmark_bordersharemore_vert
Aquaculture,South Australia,2,"South African fishermen, oyster farmers fear power-generating ship will kill business",Neutral,,Reuters18 June 2021bookmark_bordersharemore_vert
Aquaculture,South Australia,0,South Australian appointed to the Murray–Darling Basin Authority,NA,,Premier of South Australia18 Decbookmark_bordersharemore_vert
Aquaculture,South Australia,3,South Australia's Coffin Bay oyster growers are back in business,Positive,,FOOD Magazine - Australia21 Decbookmark_bordersharemore_vert
Aquaculture,South Australia,0,South Australia's fisheries on the world stage,NA,,Premier of South Australia21 Septbookmark_bordersharemore_vert
Aquaculture,South Australia,2,South Australia's lobster season starts as markets tighten,Neutral,,ABC News15 Septbookmark_bordersharemore_vert
Aquaculture,South Australia,0,South Australia's top 100 companies: 80-61,NA,,InDaily19 Octbookmark_bordersharemore_vert
Aquaculture,Queensland,3,South Coast oyster farmer goes global with breakthrough app,Positive,,North Queensland Register30 Augbookmark_bordersharemore_vert
Aquaculture,South Australia,2,Southern Australia identified as potential aquaculture hotspot,Neutral,,The Lead South Australiabookmark_bordersharemore_vert
Aquaculture,Victoria,2,Southern Australia identified as potential aquaculture hotspot,Neutral,,The Lead South Australiabookmark_bordersharemore_vert
Aquaculture,New South Wales,2,Southern Australia identified as potential aquaculture hotspot,Neutral,,The Lead South Australiabookmark_bordersharemore_vert
Aquaculture,Australian Capital Territory,0,Southland Aquaculture Group welcomes call for seaweed body,NA,,Stuff.co.nz20 Septbookmark_bordersharemore_vert
Aquaculture,Queensland,0,Spanish mackerel stock report 'imminent' as stakeholders fear for fishery's future,NA,,ABC News21 Novbookmark_bordersharemore_vert
Aquaculture,Victoria,0,Spanish mackerel stock report 'imminent' as stakeholders fear for fishery's future,NA,,ABC News21 Novbookmark_bordersharemore_vert
Aquaculture,New South Wales,0,Spanish mackerel stock report 'imminent' as stakeholders fear for fishery's future,NA,,ABC News21 Novbookmark_bordersharemore_vert
Aquaculture,Queensland,0,"Spanish mackerel stocks under threat from overfishing, government says",NA,,ABC News14 June 2021bookmark_bordersharemore_vert
Aquaculture,Tasmania,2,Stanley Wharf being considered as potential base for fish farming in north-west Tasmania,Neutral,,ABC Newsbookmark_bordersharemore_vert
Aquaculture,South Australia,0,State aid: Commission approves €9.8 million Charleroi,NA,,European Commission12 Novbookmark_bordersharemore_vert
